company_name,url,tier,lead_score,website_quality_score,summary,observations,opportunities
Stirvik Business Solutions Pvt. Ltd,https://strivik.com/,hot,90,15,"Poor website design and minimal content, but high lead score suggests high potential for growth opportunities",Minimal and outdated content | Poor mobile responsiveness,Digital Marketing Services | Implementation Solutions
BizDateUp Technologies Pvt Ltd,https://www.bizdateup.com/,hot,90,25,"Poor website quality suggests a potential strong sales lead, but requires further content development and polish.","Minimalistic design with little to no descriptive content on key pages. | Mixed use of serif and sans-serif fonts, inconsistent typography and formatting.",Customized startup investment services tailored to BizDateUp's unique platform. | Expertise in accelerator management for strategic investors and their portfolio companies.
Hind Rectifiers Ltd,https://hirect.com/,hot,90,60,"A traditional company with a solid history, requiring modern web presence improvement",Website navigation is somewhat complex and non-intuitive. | Company history and mission page are minimalized and lack detailed information.,"Tailored digital marketing services, including SEO optimization and social media marketing"
Apple Inc.,https://www.apple.com/in/,hot,90,70,"Apple's website is complex and feature-rich, implying a high lead score due to potential for improvement in digital presence",Complex website with many products and categories; No clear calls-to-action | Lack of direct contact information for sales and customer support,E-commerce and mobile optimization services | Digital marketing strategy to improve user engagement and conversion rates
CapSavvy Consultants Pvt Ltd,https://capsavvy.in/,hot,80,60,"Impressive lead score suggests strong sales potential, but outdated website design and unclear USP need to be addressed","Outdated design, unclear calls-to-action | Lack of clear unique selling proposition (USP)",Digital marketing services such as SEO and paid ads | Website redesign and modernization
Classic Partners LLP,https://theclassicpartners.com/,hot,70,0,Classic Partners LLP has a solid foundation but requires revamp to reflect modern branding and showcase its distinct selling points.,"Minimal branding, excessive content duplication on service pages. | Missing trust badges, reviews sections","Audit, Tax & Compliance services (strong expertise) | Digital Transformation Services (Website Redesign, SEO)"
WolfX,https://wolfx.io,cold,0,0,Known competitor - excluded from qualification (no scrape or LLM call made).,,
